<?xml version="1.0" encoding="UTF-8"?>
<!DOCTYPE richiesteAccredito SYSTEM "richiesteAccredito.dtd">

<richiesteAccredito>

    <richiesta status="in-sospeso">
        <id>1</id>
        <richiedente>mario</richiedente>
        <somma>50</somma>
    </richiesta>

    <richiesta status="accettata">
        <id>2</id>
        <richiedente>ciruzzo</richiedente>
        <somma>100</somma>
    </richiesta>

    <richiesta status="rifiutata">
        <id>3</id>
        <richiedente>mario</richiedente>
        <somma>20</somma>
    </richiesta>

</richiesteAccredito>
